{
  "schema_version": 1,
  "scope": "offline_only_partial_fixtures_not_live_corpus",
  "planned_live_case_count": 87,
  "unprepared_case_count": 45,
  "blocked_categories": [
    "IBAN_CODE",
    "SAUDI_NATIONAL_ID",
    "SAUDI_RESIDENT_ID",
    "SAUDI_VAT_ID",
    "SAUDI_BANK_ACCOUNT"
  ],
  "cases": [
    {
      "case_id": "safe-email-address-en-001",
      "language": "en",
      "synthetic": true,
      "kind": "positive",
      "target_categories": [
        "EMAIL_ADDRESS"
      ],
      "text": "Synthetic review: fixture@example.invalid; SAR 240.00; 2026-01; evidence-fixture-001.",
      "expected_spans": [
        {
          "start": 18,
          "end": 41,
          "category": "EMAIL_ADDRESS"
        }
      ],
      "provenance_ids": [
        "rfc2606"
      ],
      "expected_action": "redact"
    },
    {
      "case_id": "safe-email-address-en-002",
      "language": "en",
      "synthetic": true,
      "kind": "positive",
      "target_categories": [
        "EMAIL_ADDRESS"
      ],
      "text": "Synthetic review: sample@example.org; SAR 240.00; 2026-01; evidence-fixture-001.",
      "expected_spans": [
        {
          "start": 18,
          "end": 36,
          "category": "EMAIL_ADDRESS"
        }
      ],
      "provenance_ids": [
        "rfc2606"
      ],
      "expected_action": "redact"
    },
    {
      "case_id": "negative-email-address-en-003",
      "language": "en",
      "synthetic": true,
      "kind": "negative",
      "target_categories": [
        "EMAIL_ADDRESS"
      ],
      "text": "Synthetic review: No email: example.invalid without a mailbox.; SAR 240.00; 2026-01; evidence-fixture-001.",
      "expected_spans": [],
      "provenance_ids": [
        "rfc2606",
        "synthetic-business-controls"
      ],
      "expected_action": "retain"
    },
    {
      "case_id": "safe-email-address-ar-004",
      "language": "ar",
      "synthetic": true,
      "kind": "positive",
      "target_categories": [
        "EMAIL_ADDRESS"
      ],
      "text": "مراجعة تجريبية: fixture@example.invalid؛ المبلغ SAR 240.00؛ الفترة 2026-01؛ evidence-fixture-001.",
      "expected_spans": [
        {
          "start": 16,
          "end": 39,
          "category": "EMAIL_ADDRESS"
        }
      ],
      "provenance_ids": [
        "rfc2606"
      ],
      "expected_action": "redact"
    },
    {
      "case_id": "safe-email-address-ar-005",
      "language": "ar",
      "synthetic": true,
      "kind": "positive",
      "target_categories": [
        "EMAIL_ADDRESS"
      ],
      "text": "مراجعة تجريبية: sample@example.org؛ المبلغ SAR 240.00؛ الفترة 2026-01؛ evidence-fixture-001.",
      "expected_spans": [
        {
          "start": 16,
          "end": 34,
          "category": "EMAIL_ADDRESS"
        }
      ],
      "provenance_ids": [
        "rfc2606"
      ],
      "expected_action": "redact"
    },
    {
      "case_id": "negative-email-address-ar-006",
      "language": "ar",
      "synthetic": true,
      "kind": "negative",
      "target_categories": [
        "EMAIL_ADDRESS"
      ],
      "text": "مراجعة تجريبية: No email: example.invalid without a mailbox.؛ المبلغ SAR 240.00؛ الفترة 2026-01؛ evidence-fixture-001.",
      "expected_spans": [],
      "provenance_ids": [
        "rfc2606",
        "synthetic-business-controls"
      ],
      "expected_action": "retain"
    },
    {
      "case_id": "safe-email-address-mixed-007",
      "language": "mixed",
      "synthetic": true,
      "kind": "positive",
      "target_categories": [
        "EMAIL_ADDRESS"
      ],
      "text": "مراجعة synthetic: fixture@example.invalid; المبلغ SAR 240.00; period 2026-01; evidence-fixture-001.",
      "expected_spans": [
        {
          "start": 18,
          "end": 41,
          "category": "EMAIL_ADDRESS"
        }
      ],
      "provenance_ids": [
        "rfc2606"
      ],
      "expected_action": "redact"
    },
    {
      "case_id": "safe-email-address-mixed-008",
      "language": "mixed",
      "synthetic": true,
      "kind": "positive",
      "target_categories": [
        "EMAIL_ADDRESS"
      ],
      "text": "مراجعة synthetic: sample@example.org; المبلغ SAR 240.00; period 2026-01; evidence-fixture-001.",
      "expected_spans": [
        {
          "start": 18,
          "end": 36,
          "category": "EMAIL_ADDRESS"
        }
      ],
      "provenance_ids": [
        "rfc2606"
      ],
      "expected_action": "redact"
    },
    {
      "case_id": "negative-email-address-mixed-009",
      "language": "mixed",
      "synthetic": true,
      "kind": "negative",
      "target_categories": [
        "EMAIL_ADDRESS"
      ],
      "text": "مراجعة synthetic: No email: example.invalid without a mailbox.; المبلغ SAR 240.00; period 2026-01; evidence-fixture-001.",
      "expected_spans": [],
      "provenance_ids": [
        "rfc2606",
        "synthetic-business-controls"
      ],
      "expected_action": "retain"
    },
    {
      "case_id": "safe-phone-number-en-010",
      "language": "en",
      "synthetic": true,
      "kind": "positive",
      "target_categories": [
        "PHONE_NUMBER"
      ],
      "text": "Synthetic review: +1 202 555 0100; SAR 240.00; 2026-01; evidence-fixture-001.",
      "expected_spans": [
        {
          "start": 18,
          "end": 33,
          "category": "PHONE_NUMBER"
        }
      ],
      "provenance_ids": [
        "nanpa-reserved-555"
      ],
      "expected_action": "redact"
    },
    {
      "case_id": "safe-phone-number-en-011",
      "language": "en",
      "synthetic": true,
      "kind": "positive",
      "target_categories": [
        "PHONE_NUMBER"
      ],
      "text": "Synthetic review: +1-202-555-0199; SAR 240.00; 2026-01; evidence-fixture-001.",
      "expected_spans": [
        {
          "start": 18,
          "end": 33,
          "category": "PHONE_NUMBER"
        }
      ],
      "provenance_ids": [
        "nanpa-reserved-555"
      ],
      "expected_action": "redact"
    },
    {
      "case_id": "negative-phone-number-en-012",
      "language": "en",
      "synthetic": true,
      "kind": "negative",
      "target_categories": [
        "PHONE_NUMBER"
      ],
      "text": "Synthetic review: Only extension 555; no complete phone number.; SAR 240.00; 2026-01; evidence-fixture-001.",
      "expected_spans": [],
      "provenance_ids": [
        "nanpa-reserved-555",
        "synthetic-business-controls"
      ],
      "expected_action": "retain"
    },
    {
      "case_id": "safe-phone-number-ar-013",
      "language": "ar",
      "synthetic": true,
      "kind": "positive",
      "target_categories": [
        "PHONE_NUMBER"
      ],
      "text": "مراجعة تجريبية: +1 202 555 0100؛ المبلغ SAR 240.00؛ الفترة 2026-01؛ evidence-fixture-001.",
      "expected_spans": [
        {
          "start": 16,
          "end": 31,
          "category": "PHONE_NUMBER"
        }
      ],
      "provenance_ids": [
        "nanpa-reserved-555"
      ],
      "expected_action": "redact"
    },
    {
      "case_id": "safe-phone-number-ar-014",
      "language": "ar",
      "synthetic": true,
      "kind": "positive",
      "target_categories": [
        "PHONE_NUMBER"
      ],
      "text": "مراجعة تجريبية: +1-202-555-0199؛ المبلغ SAR 240.00؛ الفترة 2026-01؛ evidence-fixture-001.",
      "expected_spans": [
        {
          "start": 16,
          "end": 31,
          "category": "PHONE_NUMBER"
        }
      ],
      "provenance_ids": [
        "nanpa-reserved-555"
      ],
      "expected_action": "redact"
    },
    {
      "case_id": "negative-phone-number-ar-015",
      "language": "ar",
      "synthetic": true,
      "kind": "negative",
      "target_categories": [
        "PHONE_NUMBER"
      ],
      "text": "مراجعة تجريبية: Only extension 555; no complete phone number.؛ المبلغ SAR 240.00؛ الفترة 2026-01؛ evidence-fixture-001.",
      "expected_spans": [],
      "provenance_ids": [
        "nanpa-reserved-555",
        "synthetic-business-controls"
      ],
      "expected_action": "retain"
    },
    {
      "case_id": "safe-phone-number-mixed-016",
      "language": "mixed",
      "synthetic": true,
      "kind": "positive",
      "target_categories": [
        "PHONE_NUMBER"
      ],
      "text": "مراجعة synthetic: +1 202 555 0100; المبلغ SAR 240.00; period 2026-01; evidence-fixture-001.",
      "expected_spans": [
        {
          "start": 18,
          "end": 33,
          "category": "PHONE_NUMBER"
        }
      ],
      "provenance_ids": [
        "nanpa-reserved-555"
      ],
      "expected_action": "redact"
    },
    {
      "case_id": "safe-phone-number-mixed-017",
      "language": "mixed",
      "synthetic": true,
      "kind": "positive",
      "target_categories": [
        "PHONE_NUMBER"
      ],
      "text": "مراجعة synthetic: +1-202-555-0199; المبلغ SAR 240.00; period 2026-01; evidence-fixture-001.",
      "expected_spans": [
        {
          "start": 18,
          "end": 33,
          "category": "PHONE_NUMBER"
        }
      ],
      "provenance_ids": [
        "nanpa-reserved-555"
      ],
      "expected_action": "redact"
    },
    {
      "case_id": "negative-phone-number-mixed-018",
      "language": "mixed",
      "synthetic": true,
      "kind": "negative",
      "target_categories": [
        "PHONE_NUMBER"
      ],
      "text": "مراجعة synthetic: Only extension 555; no complete phone number.; المبلغ SAR 240.00; period 2026-01; evidence-fixture-001.",
      "expected_spans": [],
      "provenance_ids": [
        "nanpa-reserved-555",
        "synthetic-business-controls"
      ],
      "expected_action": "retain"
    },
    {
      "case_id": "safe-credit-card-en-019",
      "language": "en",
      "synthetic": true,
      "kind": "positive",
      "target_categories": [
        "CREDIT_CARD"
      ],
      "text": "Synthetic review: 4242 4242 4242 4242; SAR 240.00; 2026-01; evidence-fixture-001.",
      "expected_spans": [
        {
          "start": 18,